{
  "name": "nextjs-plugin",
  "version": "0.0.2",
  "description": "Next.js full-stack React framework stack provider for SDLC marketplace. Multi-aspect ownership (backend + frontend). App Router, Server Components, Server Actions, Route Handlers, ISR/SSG/SSR. Reuses TypeScript and npm skills from nodejs-plugin.",
  "author": {
    "name": "Oleksii Kruhlyk",
    "url": "https://github.com/AratKruglik"
  },
  "license": "MIT",
  "homepage": "https://github.com/AratKruglik/claude-sdlc",
  "keywords": [
    "nextjs",
    "react",
    "typescript",
    "fullstack",
    "ssr",
    "rsc",
    "sdlc",
    "stack-provider"
  ],
  "dependencies": [
    "sdlc",
    "js-foundation"
  ]
}