{
  "name": "vue-plugin",
  "version": "0.0.1",
  "description": "Vue 3 SPA frontend stack provider for SDLC marketplace. Composition API, <script setup>, Pinia, Vue Router v4, vee-validate, Vitest + @vue/test-utils. Vue 3 primary; Vue 2 fallback notes for legacy projects. Nuxt out of scope (separate plugin in roadmap).",
  "author": {
    "name": "ROLIQUE",
    "url": "https://github.com/ROLIQUE"
  },
  "license": "MIT",
  "homepage": "https://github.com/ROLIQUE/claude-plugins",
  "keywords": ["vue", "vue3", "spa", "frontend", "typescript", "sdlc", "stack-provider"],
  "dependencies": ["sdlc", "js-foundation"]
}