{
  "name": "nestjs-plugin",
  "version": "0.0.2",
  "description": "NestJS opinionated backend stack provider for SDLC marketplace. Replaces nodejs-plugin for projects with @nestjs/core. Covers REST + ORM (TypeORM/Prisma/Mongoose) + GraphQL + WebSockets + Microservices. Reuses TypeScript and npm skills from nodejs-plugin.",
  "author": {
    "name": "ROLIQUE",
    "url": "https://github.com/ROLIQUE"
  },
  "license": "MIT",
  "homepage": "https://github.com/ROLIQUE/claude-plugins",
  "keywords": [
    "nestjs",
    "typescript",
    "backend",
    "sdlc",
    "stack-provider"
  ],
  "dependencies": [
    "sdlc",
    "js-foundation"
  ]
}