{
  "name": "nodejs-plugin",
  "version": "0.0.2",
  "description": "Node.js backend stack provider for SDLC marketplace. Adds node-architect agent and node-conventions skill for Express/Fastify/Koa/plain Node.js projects. Reuses TypeScript and npm skills from js-foundation. Composes with frontend plugins (react, vue, angular) via aspect resolution.",
  "author": {
    "name": "Oleksii Kruhlyk",
    "url": "https://github.com/AratKruglik"
  },
  "license": "MIT",
  "homepage": "https://github.com/AratKruglik/claude-sdlc",
  "keywords": [
    "nodejs",
    "express",
    "fastify",
    "koa",
    "sdlc",
    "stack-provider"
  ],
  "dependencies": [
    "sdlc",
    "js-foundation"
  ]
}