{
  "name": "fastapi-plugin",
  "version": "0.0.1",
  "description": "FastAPI backend + database stack provider (priority=150). Detects fastapi in pyproject.toml/requirements.txt. Provides fastapi-architect (Sonnet/medium — APIRouter, Pydantic v2 schemas, Depends injection, async endpoints, OAuth2/JWT, OpenAPI, SQLAlchemy model stubs, API contract for SPA frontends) and alembic-specialist (Sonnet/low — SQLAlchemy 2.0 mapped classes, alembic revision --autogenerate, migration review, alembic upgrade head, verification) agents plus fastapi-conventions and sqlalchemy-patterns skills. Reuses python-foundation skills. Extra database phase after development.",
  "author": {
    "name": "Oleksii Kruhlyk",
    "url": "https://github.com/AratKruglik"
  },
  "license": "MIT",
  "homepage": "https://github.com/AratKruglik/claude-sdlc",
  "keywords": ["python", "fastapi", "pydantic", "sqlalchemy", "alembic", "backend", "database", "sdlc", "stack-provider"],
  "dependencies": ["sdlc", "python-foundation"]
}
